{"schema":"ecm-tqag.constructed-item.v1","item_id":"synthetic-rights-cleared-001","package_sha256":"48777e8f517f16932958c5f83e32718d5d207c4cb8375a82ae6b89ddbcf0b65a","motif":{"type":"definition-cardinality","evidence_nodes":["top","left","right"]},"derivation":["identify the stated geometric object","extract its stated side count"],"answer_atoms":[{"atom_id":"side-count","value":"three","kind":"cardinality"}],"provenance_trace":[{"atom_id":"side-count","source_ref":"evidence.text:sentence-1"}],"question":"How many sides does the described shape have?","choices":["Two","Three","Four","Five"],"answer_index":1,"answer":"Three","rationale":"The evidence states that a triangle has three sides."}
